{
  "$schema": "https://json-schema.org/draft/2020-12/schema",
  "$id": "https://stegverse.org/schemas/validation-evidence-manifest.schema.json",
  "title": "Governed Validator Manifest",
  "type": "object",
  "additionalProperties": false,
  "required": ["manifest_version", "manifest_id", "validators", "authority_boundary"],
  "properties": {
    "manifest_version": {"type": "string", "pattern": "^[0-9]+\\.[0-9]+\\.[0-9]+$"},
    "manifest_id": {"type": "string", "minLength": 1},
    "description": {"type": "string"},
    "validators": {
      "type": "array",
      "minItems": 1,
      "items": {
        "type": "object",
        "additionalProperties": false,
        "required": ["id", "command", "required"],
        "properties": {
          "id": {"type": "string", "pattern": "^[a-z0-9][a-z0-9_-]*$"},
          "command": {"type": "array", "minItems": 1, "items": {"type": "string", "minLength": 1}},
          "required": {"type": "boolean"},
          "working_directory": {"type": "string"},
          "timeout_seconds": {"type": "integer", "minimum": 1},
          "evidence_class": {"type": "string"}
        }
      }
    },
    "authority_boundary": {
      "type": "object",
      "additionalProperties": false,
      "required": ["may_promote_publication", "may_assert_source_completeness", "may_change_factual_confidence"],
      "properties": {
        "may_promote_publication": {"const": false},
        "may_assert_source_completeness": {"const": false},
        "may_change_factual_confidence": {"const": false}
      }
    }
  }
}
