{
  "manifest_version": "1.0.0",
  "manifest_id": "ERL-REPOSITORY-CORE-VALIDATION",
  "description": "Repository-wide governed validator set. Execution success does not promote factual or publication status.",
  "validators": [
    {
      "id": "assessment_trees",
      "command": ["python", "scripts/validate_assessment_trees.py"],
      "required": true,
      "working_directory": ".",
      "timeout_seconds": 900,
      "evidence_class": "repository-structure"
    },
    {
      "id": "primary_record_intake",
      "command": ["python", "scripts/validate_primary_record_intake.py"],
      "required": true,
      "working_directory": ".",
      "timeout_seconds": 900,
      "evidence_class": "intake-structure"
    },
    {
      "id": "activation_validation",
      "command": ["python", "scripts/run_activation_validation.py"],
      "required": true,
      "working_directory": ".",
      "timeout_seconds": 1800,
      "evidence_class": "combined-activation"
    }
  ],
  "authority_boundary": {
    "may_promote_publication": false,
    "may_assert_source_completeness": false,
    "may_change_factual_confidence": false
  }
}
